headline,link,image
Phil Oh’s Best Street Style Photos From the Spring 2025 Shows in Milan,/slideshow/phil-ohs-best-street-style-photos-from-the-spring-2025-shows-in-milan,https://assets.vogue.com/photos/66ecd3ecd30745e2c77fd228/3:4/w_1024%2Cc_limit/MILAN-STREETSTYLE-PHILOH-DAY3-%252042.jpg
Yay or Neigh? McQueen’s Hoof Boots Are Put to the Test,/article/mcqueen-hoof-boot-test-drive-fashion-month,https://assets.vogue.com/photos/66d9c5c83900877b0cb020ca/1:1/w_640%2Cc_limit/McQueen_%25201%2520(1)4.jpg
"Please, Let Us End the Tyranny of Full Runway Looks",/article/please-let-us-end-the-tyranny-of-full-runway-looks,https://assets.vogue.com/photos/66ec80452a1f38c99b63487c/1:1/w_640%2Cc_limit/Holding.png
How Officiating a Wedding Upped My Suiting Game,/article/what-to-wear-when-ordaining-a-wedding-suit-fashion,https://assets.vogue.com/photos/66eaded551428db39f94ddb1/1:1/w_640%2Cc_limit/1%2520nadine%2520jordan%2520film-480%2520(1)5.jpg
It Was a Weird Shoe Summer,/slideshow/weird-shoe-summer,https://assets.vogue.com/photos/66508582a993d7a89bc1739b/1:1/w_640%2Cc_limit/GettyImages-2154266194.jpg
No headline available,https://www.vogue.com/article/fall-2024-hair-trends#intcid=_vogue-verso-hp-trending_35a2dfe8-f905-4bdb-8b5f-9885281fb2fb_popular4-1,https://assets.vogue.com/photos/66cb4d4e32c18584d61d542d/1:1/w_320%2Cc_limit/2167157268
No headline available,https://www.vogue.com/article/matilda-djerf-stockholm-apartment#intcid=_vogue-verso-hp-trending_35a2dfe8-f905-4bdb-8b5f-9885281fb2fb_popular4-1,https://assets.vogue.com/photos/66d49538fde0797616211441/1:1/w_320%2Cc_limit/Matilda_2.jpg
No headline available,https://www.vogue.com/article/the-brutalist-venice-film-festival-review#intcid=_vogue-verso-hp-trending_35a2dfe8-f905-4bdb-8b5f-9885281fb2fb_popular4-1,https://assets.vogue.com/photos/66d475b8b9f636b8709a72e7/1:1/w_320%2Cc_limit/TheBrutalist_Image1_AdrienBrody&FelicityJones_Courtesy%2520Lol%2520Crawley.jpg
The Best Vintage Stores in Dallas Fort Worth,/article/the-best-vintage-stores-in-dallas-fort-worth,https://assets.vogue.com/photos/661f7dbb9fdaf199422e5984/3:4/w_1600%2Cc_limit/US-MOCKUP-DALLAS-RAREVINTAGE-NEW.jpg
The Best Vintage Stores in Milan,/article/best-vintage-stores-in-milan,https://assets.vogue.com/photos/660b8223e187f37672c4f8a4/3:4/w_1600%2Cc_limit/MOCKUP-MILAN-MADAME-1.jpg
The Best Vintage Stores in São Paulo,/article/best-vintage-stores-in-sao-paulo,https://assets.vogue.com/photos/6621c25c43c8716d16f4f5c1/3:4/w_1600%2Cc_limit/VINTAGEGUIDE-LAMERICA-MOCKUP-SAOPAOLO-1.jpg
The Best Vintage Stores in Beirut,/article/best-vintage-stores-in-beirut,https://assets.vogue.com/photos/6621c6c171747dae359b350f/3:4/w_1600%2Cc_limit/VINTAGEGUIDE-MIDEAST-MOCKUP-BEIRUIT-1B.jpg
The Best Vintage Stores in Tokyo,/article/best-vintage-stores-in-tokyo,https://assets.vogue.com/photos/661fd32e32a25a0384b92ca4/3:4/w_1600%2Cc_limit/ASIA-MOCKUP-TOKYO-CASANOVA.jpg
"At The Sweat Tour at Madison Square Garden, Brat Summer Never Really Dies",/slideshow/sweat-tour-madison-square-garden-brat-summer-charli-xcx-troye-sivan,https://assets.vogue.com/photos/66f305badde97c0b44b14b52/4:3/w_2560%2Cc_limit/SWEAT-STORY.jpg
Phil Oh’s Best Street Style Photos From the Spring 2025 Shows in Paris,/slideshow/phil-ohs-best-street-style-photos-from-the-spring-2025-shows-in-paris,https://assets.vogue.com/photos/66f2cd95166d80029a0d46a9/4:3/w_2560%2Cc_limit/PFW_SS25_STREETSTYLE_DAY1_PHILOH_01.jpg
The Best Street Style Photos From the Spring 2025 Shows in London,/slideshow/the-best-street-style-photos-from-the-spring-2025-shows-in-london,https://assets.vogue.com/photos/66e986450b2fdf4a665ff77c/4:3/w_2560%2Cc_limit/LFW%2520_SS25%2520_STREETSTYLE%2520_PHILOH_26.jpg
Phil Oh Shoots the Best Street Style From the Spring 2025 Shows in New York,/slideshow/phil-oh-best-street-style-photos-spring-2025-new-york,https://assets.vogue.com/photos/66e34a5e408cc32f9fb90d16/4:3/w_2560%2Cc_limit/NYFW_SS25_STREETSTYLE_DAY7_PHILOH_07.jpg
"At the 2024 Democratic National Convention, Democrats Used Pop Culture to Build a Generational Bridge",/article/democratic-party-pop-culture-2024-dnc,https://assets.vogue.com/photos/66c8ab2baf6dff2ef8fa7c17/4:3/w_2560%2Cc_limit/DNC_EmilyMalan_Day2_27RZ.jpg
"This Summer, It’s All About Small—but Not Tiny!—Sunglasses",/article/small-sunglasses-summer-trend-90s-2000s,https://assets.vogue.com/photos/66c652081484054f0924d92b/4:3/w_2560%2Cc_limit/Collage%2520(1).jpg
Soft Toys Are Everywhere At Copenhagen Fashion Week.VogueInvestigates,/article/soft-toys-are-everywhere-at-copenhagen-fashion-week-vogue-investigates,https://assets.vogue.com/photos/66b53514cafbd859f671421f/4:3/w_2560%2Cc_limit/BV-PCPH.jpg
Don’t Discount the Power of a Little White Sock,/article/white-crew-socks-trend-gen-z-tiktok,https://assets.vogue.com/photos/66a91652f02695a6990b9d58/4:3/w_2560%2Cc_limit/Loafers%2520Collage%2520(1).jpg
All The Celebrities At Paris Fashion Week SS25,/slideshow/all-the-celebrities-at-paris-fashion-week-spring-2025,https://assets.vogue.com/photos/66f31800ac01f01151e554a6/4:3/w_2560%2Cc_limit/GettyImages-2174232756.jpg
France's Brigitte Macron Attends Her First Dior Show,/article/brigitte-macron-first-dior-show,https://assets.vogue.com/photos/66f30234d354e7634593db5e/4:3/w_2560%2Cc_limit/2173419906
Kendall Jenner Means Business in Her Paris Power Suit,/article/kendall-jenner-paris-power-suit,https://assets.vogue.com/photos/66f2e001c9845aaa585e08e6/4:3/w_2560%2Cc_limit/BGUS_3039572_008%2520(2)5.jpeg
Gwyneth Paltrow Brings Her Coolest Sneakers to Paris Fashion Week,/article/gwyneth-paltrow-brings-her-coolest-sneakers-paris-fashion-week,https://assets.vogue.com/photos/66f2c97bbd263cf0995c2614/4:3/w_2560%2Cc_limit/BLU_A98701560.jpg
The Hottest Eyewear Brand Of Fashion Month Is Designed By This Canadian Couple,/article/fellow-earthlings-runway-sunglasses-luar-anna-sui,https://assets.vogue.com/photos/66f2feefa2dd6e5f1bd6ffc6/4:3/w_1600%2Cc_limit/Collage%2520Holding.jpg
The Best Behind-the-Scenes Photos at the Paris Spring 2025 Shows,/slideshow/the-best-behind-the-scenes-photos-at-the-paris-spring-2025-shows,https://assets.vogue.com/photos/66f2d36c838c21b18c1b46fe/4:3/w_1600%2Cc_limit/CHRISTIANDIOR_SS25_BACKSTAGE_ACIELLESTYLEDUMONDE_03.jpg
Let The Sunshine In: Belgian Designer Julie Kegels Brings Surf Style to Paris Fashion Week,/article/let-the-sunshine-in-belgian-designer-julie-kegels-brings-surf-style-to-paris-fashion-week,https://assets.vogue.com/photos/66f300714166d4af587792f2/4:3/w_1600%2Cc_limit/JULIE%2520KEGELS%2520SS25_Look-15.jpg
Sydney Sweeney Has a Spare Wig in Her Miu Miu Bag. Don’t You?,/article/in-the-bag-sydney-sweeney,https://assets.vogue.com/photos/66ed9104f72ad5cf447df627/4:3/w_1600%2Cc_limit/vogue_in-the-bag-sydney-sweeney.jpg
Bella Hadid Gives Us Her Take on Parisian Chic,/article/bella-hadid-parisian-chic-paris-fashion-week-spring-2025,https://assets.vogue.com/photos/66f2c1dc85693d9f3592c461/4:3/w_1600%2Cc_limit/GettyImages-2173967494.jpg
On the Podcast: Breaking Down a Joyful Milan Fashion Week,/article/on-the-podcast-milan-fashion-week-spring-2025,https://assets.vogue.com/photos/66f1cad6dcbed2b24c64e51a/4:3/w_1600%2Cc_limit/Sunnei_SS25_Backstage_AcielleStyleDuMonde_04.jpg
Nobody Had a Better Milan Fashion Week Than Marina Abramović,/article/milan-fashion-week-marina-abramovic,https://assets.vogue.com/photos/66f1912f8c940919270b23f0/4:3/w_1600%2Cc_limit/2173540621
Happy Fall! Here Are 31 Vintage Pictures of Meg Ryan,/slideshow/31-vintage-pictures-of-meg-ryan,https://assets.vogue.com/photos/66f19ac83361bb435888640f/4:3/w_1600%2Cc_limit/Collage.jpg
Why Is Every Celebrity Suddenly Wearing Tamara Ralph?,/article/tamara-ralph-celebrities-red-carpet-hollywood,https://assets.vogue.com/photos/66f18c6c02e42661b94ee6fb/4:3/w_1600%2Cc_limit/Holding%2520Collage%2520(2)%2520(1)5.png
Kendall Jenner Continues Her Love Affair With Alaïa,/article/kendall-jenner-continues-her-love-affair-with-alaia,https://assets.vogue.com/photos/66f174e3701af8d6eab784cb/4:3/w_1600%2Cc_limit/BLU_A98670317.jpg
Bella Hadid Has Returned to PFW In a Take-Charge Trench Coat,/article/bella-hadid-paris-fashion-week-trench,https://assets.vogue.com/photos/66f185f678b7db60925aa920/4:3/w_1600%2Cc_limit/DR-VOGUK-230924-02.jpg
Why Jacob Elordi’s Custom Bottega Bag Matters,/article/why-jacob-elordis-custom-bottega-bag-matters,https://assets.vogue.com/photos/66f159f4b916720e1572ba6a/4:3/w_1600%2Cc_limit/GettyImages-2173669791.jpg
“There’s This Very Audacious Thing About Him”—A Conversation Between Jean Paul Gaultier and His New Guest Designer Ludovic de Saint Sernin,/article/jean-paul-gaultier-and-ludovic-de-saint-sernin,https://assets.vogue.com/photos/66f022efd134e8800b262705/4:3/w_1600%2Cc_limit/IMAGE_02_0656_03.jpg
Mary-Kate and Ashley Olsen Find a Home for The Row in Paris,/article/mary-kate-and-ashley-olsen-the-row-store-paris,https://assets.vogue.com/photos/66f026b805cfa7656175a64c/4:3/w_1600%2Cc_limit/MONT%2520THABOR_2.jpg
Taylor Swift and Gigi Hadid Step Out in BFF Trench Coats,/article/taylor-swift-gigi-hadid-bff-trench-coats,https://assets.vogue.com/photos/66f03cf4fb4ee5dd38953f8c/4:3/w_1600%2Cc_limit/BGUS_3037196_002%2520(2)4.jpg
"Zendaya’s Going-Out Looks? They’re Fresh Off the Runway, Of Course",/article/zendaya-going-out-fashion-spring-runways,https://assets.vogue.com/photos/66f0151b576fdf4e23a62f4a/4:3/w_1600%2Cc_limit/GettyImages-2173620118%2520(2)4.jpg
All the Celebrities at Milan Fashion Week Spring 2025,/slideshow/milan-fashion-week-spring-2025-front-row,https://assets.vogue.com/photos/66ef1da926998c20c0f724c7/4:3/w_1600%2Cc_limit/GettyImages-2173576962.jpg
Imane Khelif Brings a Glimmer of Gold to a Starry Bottega Veneta Front Row,/article/imane-khelif-bottega-veneta-spring-2025-front-row,https://assets.vogue.com/photos/66ef18469be84eaf9a06a298/4:3/w_1600%2Cc_limit/2173568401
Backstage at the Milan Spring 2025 Shows,/slideshow/backstage-at-the-milan-spring-2025-shows,https://assets.vogue.com/photos/66ef15bf2a725e28bef2a104/4:3/w_1600%2Cc_limit/DIESEL_SS25_BACKSTAGE_ACIELLESTYLEDUMONDE_04.jpg
Amelia Gray Is Turning Fashion Month Into Her Personal Runway,/slideshow/amelia-gray-spring-2025-model-off-duty-style,https://assets.vogue.com/photos/66eedecd57ce8a950f5c1744/4:3/w_1600%2Cc_limit/2172967574
